{
	"schemaVersion": "2.0.0",
	"manifestVersion": "sc01-fullres-review-20261005-v2",
	"catalogVersion": "sc01-draft-20260121",
	"publicationVersion": "sc01-fullres-review-20261005-v2",
	"vehicleId": "sc01",
	"generatedAt": "2026-10-05T08:14:23.881Z",
	"renderer":
	{
		"engineVersion": "5.8.1-56057345+++UE5+Release-5.8",
		"mode": "realtime",
		"samplesPerPixel": 0,
		"outputWidth": 2044,
		"outputHeight": 1328,
		"denoiser": false
	},
	"alphaProcessing":
	{
		"alphaMode": "straight",
		"autoDetectCoverageInversion": true,
		"clearTransparentRgb": true,
		"glowPolicy": "synthetic-alpha"
	},
	"renders": [
		{
			"renderKey": "sc01__sc01-draft-20260121__render-025d946ef6d93b0435b63dda",
			"renderViewId": "front",
			"path": "renders/sc01-fullres-review-20261005-v2/sc01/sc01__sc01-draft-20260121__render-025d946ef6d93b0435b63dda/front.png",
			"width": 2044,
			"height": 1328,
			"format": "png",
			"colorSpace": "sRGB",
			"alphaMode": "straight",
			"coverageInverted": true,
			"normalizationRequired": true,
			"glowRecoveredPixels": 9375,
			"sha256": "19572b801194a67485e86eba7e5ae4f4f470b7f38a49a4eb08419d67606fc2cc",
			"status": "ready"
		},
		{
			"renderKey": "sc01__sc01-draft-20260121__render-025d946ef6d93b0435b63dda",
			"renderViewId": "front-left",
			"path": "renders/sc01-fullres-review-20261005-v2/sc01/sc01__sc01-draft-20260121__render-025d946ef6d93b0435b63dda/front-left.png",
			"width": 2044,
			"height": 1328,
			"format": "png",
			"colorSpace": "sRGB",
			"alphaMode": "straight",
			"coverageInverted": true,
			"normalizationRequired": true,
			"glowRecoveredPixels": 1957,
			"sha256": "2929197f5b571088acf855b7d89cdd257141baa02d64727369e3675590c17ed2",
			"status": "ready"
		},
		{
			"renderKey": "sc01__sc01-draft-20260121__render-025d946ef6d93b0435b63dda",
			"renderViewId": "side",
			"path": "renders/sc01-fullres-review-20261005-v2/sc01/sc01__sc01-draft-20260121__render-025d946ef6d93b0435b63dda/side.png",
			"width": 2044,
			"height": 1328,
			"format": "png",
			"colorSpace": "sRGB",
			"alphaMode": "straight",
			"coverageInverted": true,
			"normalizationRequired": true,
			"glowRecoveredPixels": 10190,
			"sha256": "a1c4fc86c1738c102a5a101b616a32b7bf54d2a82964562f7da02b66e7155a49",
			"status": "ready"
		},
		{
			"renderKey": "sc01__sc01-draft-20260121__render-025d946ef6d93b0435b63dda",
			"renderViewId": "rear-right",
			"path": "renders/sc01-fullres-review-20261005-v2/sc01/sc01__sc01-draft-20260121__render-025d946ef6d93b0435b63dda/rear-right.png",
			"width": 2044,
			"height": 1328,
			"format": "png",
			"colorSpace": "sRGB",
			"alphaMode": "straight",
			"coverageInverted": true,
			"normalizationRequired": true,
			"glowRecoveredPixels": 745,
			"sha256": "6748f6b1775e0de093c3f60b158ebcafd236a9cfbea33c7b2b3343aac52e8c55",
			"status": "ready"
		},
		{
			"renderKey": "sc01__sc01-draft-20260121__render-400d7a020880430b44829855",
			"renderViewId": "front",
			"path": "renders/sc01-fullres-review-20261005-v2/sc01/sc01__sc01-draft-20260121__render-400d7a020880430b44829855/front.png",
			"width": 2044,
			"height": 1328,
			"format": "png",
			"colorSpace": "sRGB",
			"alphaMode": "straight",
			"coverageInverted": true,
			"normalizationRequired": true,
			"glowRecoveredPixels": 3423,
			"sha256": "1c8c7dd26c7c59c4bfe910535f0a875dbbb8829867a0174b88dd3d0f647f10c8",
			"status": "ready"
		},
		{
			"renderKey": "sc01__sc01-draft-20260121__render-400d7a020880430b44829855",
			"renderViewId": "front-left",
			"path": "renders/sc01-fullres-review-20261005-v2/sc01/sc01__sc01-draft-20260121__render-400d7a020880430b44829855/front-left.png",
			"width": 2044,
			"height": 1328,
			"format": "png",
			"colorSpace": "sRGB",
			"alphaMode": "straight",
			"coverageInverted": true,
			"normalizationRequired": true,
			"glowRecoveredPixels": 75,
			"sha256": "f89e443e5edc2a6bd212ec269dc4763f65cb9f3c06252822be0a3e5a5ff02da3",
			"status": "ready"
		},
		{
			"renderKey": "sc01__sc01-draft-20260121__render-400d7a020880430b44829855",
			"renderViewId": "side",
			"path": "renders/sc01-fullres-review-20261005-v2/sc01/sc01__sc01-draft-20260121__render-400d7a020880430b44829855/side.png",
			"width": 2044,
			"height": 1328,
			"format": "png",
			"colorSpace": "sRGB",
			"alphaMode": "straight",
			"coverageInverted": true,
			"normalizationRequired": true,
			"glowRecoveredPixels": 14279,
			"sha256": "50485112863f0648014ba31611186e43fec03dde939994fe52723ee2df74059c",
			"status": "ready"
		},
		{
			"renderKey": "sc01__sc01-draft-20260121__render-400d7a020880430b44829855",
			"renderViewId": "rear-right",
			"path": "renders/sc01-fullres-review-20261005-v2/sc01/sc01__sc01-draft-20260121__render-400d7a020880430b44829855/rear-right.png",
			"width": 2044,
			"height": 1328,
			"format": "png",
			"colorSpace": "sRGB",
			"alphaMode": "straight",
			"coverageInverted": true,
			"normalizationRequired": true,
			"glowRecoveredPixels": 155,
			"sha256": "92b013dbc3c8f9b2fb12e18ce3603e1cc70366821238e2faa629c35890d00330",
			"status": "ready"
		}
	]
}